[
  {
    "interpretationId": "nazi-germany-interpretation-001",
    "caseId": "nazi-germany",
    "claimIds": [
      "nazi-germany-claim-001"
    ],
    "theoryId": "koenigsberg-immortal-body-v1",
    "variableId": "collective-immortality",
    "interpretation": "The draft evidence chain supports a preliminary reading of the Nazi Volksgemeinschaft as an imagined collective body whose sacred survival justified individual sacrifice.",
    "reviewStatus": "argument-review",
    "publicationStatus": "draft",
    "confidence": {
      "value": 0.6,
      "label": "moderate",
      "rationale": "Interpretation is plausible and theory-aligned, but still depends on verified primary-source quotation and additional corroboration.",
      "uncertaintyFactors": [
        "source-verification-pending",
        "limited-source-coverage"
      ]
    },
    "mechanism": "collective-immortality-to-sacrifice",
    "mechanismSummary": "The national body is represented as enduring beyond individual mortality, making bodily sacrifice meaningful as participation in collective survival.",
    "alternativeMechanisms": [
      "sacred-enemy-escalation",
      "institutional-self-preservation"
    ],
    "sacrificeForm": [
      "death",
      "killing",
      "conscience"
    ],
    "sacrificeHealth": "pathological",
    "sacrificeBoundedness": "unbounded",
    "sacrificeTarget": "mixed",
    "definitionRefs": [
      "sacred-political-order",
      "collective-immortality",
      "sacrifice",
      "pathology"
    ],
    "codebookVersion": "v1.1"
  },
  {
    "interpretationId": "nazi-germany-interpretation-002",
    "caseId": "nazi-germany",
    "claimIds": [
      "nazi-germany-claim-001"
    ],
    "theoryId": "general-theory-political-pathology-v1",
    "variableId": "sacred-political-order-strength",
    "mechanism": "collective-immortality-to-sacrifice",
    "mechanismSummary": "The draft chain identifies a totalizing national sacred political order that organizes belonging, legitimacy, memory, obligation, and sacrifice.",
    "alternativeMechanisms": [
      "sacred-enemy-escalation",
      "institutional-self-preservation"
    ],
    "sacrificeForm": [
      "death",
      "killing",
      "conscience"
    ],
    "sacrificeHealth": "pathological",
    "sacrificeBoundedness": "unbounded",
    "sacrificeTarget": "mixed",
    "definitionRefs": [
      "sacred-political-order",
      "sacred-political-order-strength",
      "sacrifice"
    ],
    "codebookVersion": "v1.1",
    "interpretation": "The Nazi Volksgemeinschaft is provisionally coded as a very strong sacred political order, while remaining explicitly draft pending verified source passages and broader evidence.",
    "reviewStatus": "argument-review",
    "publicationStatus": "draft",
    "confidence": {
      "value": 0.55,
      "label": "moderate",
      "rationale": "The structural pattern is well aligned with the codebook, but current evidence is a thin demonstration chain.",
      "uncertaintyFactors": [
        "source-verification-pending",
        "limited-source-coverage"
      ]
    }
  },
  {
    "interpretationId": "nazi-germany-interpretation-003",
    "caseId": "nazi-germany",
    "claimIds": [
      "nazi-germany-claim-002"
    ],
    "theoryId": "general-theory-political-pathology-v1",
    "variableId": "corrigibility",
    "interpretation": "The Nazi sacred political order scores at minimum corrigibility: the Wehrmacht oath's 'unconditional obedience' and readiness to die for the oath eliminated institutional capacity for legitimate dissent within the armed forces by converting legal obligation from constitutional duty to personal fealty to the Führer; simultaneously, the Law Against Formation of New Parties legally extinguished the pluralist competition that enables order self-correction. Together these two legal acts in 1933–1934 completed the structural elimination of corrigibility: no institutional actor could legitimately challenge the sacred political order's direction without violating a personal sacred oath or committing a criminal act. This is the corrigibility-elimination that distinguishes Nazi Germany from the restrained-reordering cases.",
    "reviewStatus": "argument-review",
    "publicationStatus": "draft",
    "confidence": {
      "value": 0.82,
      "label": "high",
      "rationale": "Claim derives from two short, legally unambiguous texts verified against authoritative sources. The corrigibility interpretation is direct: unconditional-obedience oath + single-party law = elimination of legitimate dissent channels. High confidence relative to most chain interpretations.",
      "uncertaintyFactors": [
        "chain-requires-integration-with-operational-documentation"
      ]
    },
    "mechanism": "institutional-self-preservation",
    "mechanismSummary": "Personal loyalty oath replacing constitutional duty + legal single-party monopoly simultaneously eliminated all institutional corrigibility mechanisms, converting legitimate dissent into personal betrayal and criminal act.",
    "alternativeMechanisms": [
      "collective-immortality-to-sacrifice",
      "frozen-pathology"
    ],
    "sacrificeForm": [
      "death",
      "bodily-risk",
      "conscience",
      "agency"
    ],
    "sacrificeHealth": "pathological",
    "sacrificeBoundedness": "unbounded",
    "sacrificeTarget": "self",
    "definitionRefs": [
      "corrigibility",
      "sacred-political-order-strength",
      "institutional-self-preservation"
    ],
    "codebookVersion": "v1.1"
  }
]
