[
  {
    "interpretationId": "revolutionary-france-interpretation-001",
    "caseId": "revolutionary-france",
    "claimIds": [
      "revolutionary-france-claim-001"
    ],
    "theoryId": "general-theory-political-pathology-v1",
    "variableId": "sacred-political-order-strength",
    "interpretation": "The revolutionary sacred political order achieved maximum sacred-political-order strength by vesting all legitimate authority exclusively in the Nation, while Robespierre's virtue-terror synthesis sacralized the revolutionary order itself as the embodiment of virtue. This produced a configuration in which the sacred political order could not be corrected without betraying the revolution — critique became treason, and terror became a moral obligation.",
    "reviewStatus": "argument-review",
    "publicationStatus": "draft",
    "confidence": {
      "value": 0.68,
      "label": "moderate",
      "rationale": "Passages are well-attested canonical texts. The mechanism is well-supported for the Terror phase. Confidence capped because the claim applies primarily to 1793–1794.",
      "uncertaintyFactors": [
        "chain-requires-expansion",
        "periodization-ambiguity"
      ]
    },
    "mechanism": "sacred-enemy-escalation",
    "mechanismSummary": "The Declaration of Rights invested the Nation with absolute sovereignty while Robespierre fused virtue and terror — making the revolutionary order itself sacred and directing violence at internal enemies whose elimination was framed as moral necessity.",
    "alternativeMechanisms": [
      "collective-immortality-to-sacrifice",
      "institutional-self-preservation"
    ],
    "sacrificeForm": [
      "death",
      "conscience",
      "agency"
    ],
    "sacrificeHealth": "pathological",
    "sacrificeBoundedness": "unbounded",
    "sacrificeTarget": "in-group",
    "definitionRefs": [
      "sacred-political-order",
      "sacred-political-order-strength",
      "sacralization",
      "sacrifice",
      "pathology"
    ],
    "codebookVersion": "v1.1"
  }
]
